{
  "schema_version": "1.0",
  "task_id": "T-QE-VERIFY-HAPPY",
  "run_id": "run-qe-verify-happy",
  "created_at": "2026-07-29T19:30:00Z",
  "scope_ref": {
    "path": "runs/engineer-boundary-test/fixture-repo/scope.json"
  },
  "implementation_ref": {
    "path": "runs/engineer-boundary-test/implementation-report.ready.json"
  },
  "attempts": [
    {
      "id": "V-1",
      "command": "pytest test_calc.py",
      "exit_code": 0,
      "classification": "pass",
      "output_summary": "2 passed in 0.05s. test_calc.py::test_add PASSED, test_calc.py::test_total_pages_non_exact_multiple_rounds_up PASSED.",
      "retried": false
    }
  ],
  "retry_policy": { "max_retries": 2 },
  "acceptance_criteria_results": [
    {
      "criteria_id": "AC-1",
      "result": "passed",
      "attempt_refs": ["V-1"],
      "evidence_summary": "pytest test_calc.py exited 0 with 2 passed: test_add (regression) and the newly added test_total_pages_non_exact_multiple_rounds_up (asserts total_pages(7, 3) == 3), confirming total_pages() now performs ceiling division and the pre-existing test still passes."
    }
  ],
  "final_verdict": "pass",
  "routed_back_to_engineer": { "routed": false }
}
