{
  "schema_version": "1.0",
  "task_id": "T-001",
  "run_id": "run-20260722-01",
  "created_at": "2026-07-22T14:30:00Z",
  "scope_ref": {
    "path": "runs/run-20260722-01/scope.json"
  },
  "implementation_ref": {
    "path": "runs/run-20260722-01/implementation-report.json"
  },
  "attempts": [
    {
      "id": "V-1",
      "command": "pytest demo-repo/tests/test_pagination.py",
      "exit_code": 0,
      "classification": "pass",
      "output_ref": "runs/run-20260722-01/verify-1.log",
      "retried": false
    }
  ],
  "retry_policy": { "max_retries": 2 },
  "acceptance_criteria_results": [
    {
      "criteria_id": "AC-1",
      "result": "passed",
      "attempt_refs": ["V-1"],
      "evidence_summary": "All pagination tests pass, including the new boundary test added for AC-1."
    }
  ],
  "final_verdict": "pass",
  "routed_back_to_engineer": { "routed": false }
}
